alias_tamil,alias_english,tamil,english,alias_tamil_sentence,alias_english_sentence,tamil_sentence,english_sentence
பேஸு மிடா2ய் / மிட்டாய்,pEsu miThaay / miTTaay,ஜெல்லி மிட்டாய்,Jelly candy,"பேஸு மிடா2ய் ஜுகு3 ஆகாரும்கின், வனிம் அப்3ப3ஸு","pEsu miThaay jugu aakaarumkin, vanim abbasu",ஜெல்லி மிட்டாய் பல்வேறு வடிவங்களிலும் வண்ணங்களிலும் கிடைக்கிறது,Jelly candy is available in various shapes and colors
கு3ள்ளெயொ,guLLeyo,இனிப்பு,Sweet,பெ3ங்கா3லு கு3ள்ளெயொ வேன் நாவ் பொடெ3யொ,benggaalu guLLeyo vEn naav poDeyo,பெங்காலி இனிப்புகள் மிகவும் பிரபலமானவை,Bengali sweets are very popular
திக்கெயொ,tikkeyo,காரம்,Savouries,"தி3வளி வேள், ஜு3கு3 தெனு கொ4ம்மொ கு3ள்ளெயொ, திக்கெயொ கெரஸுனு","divaLi vEL, jugu tenu ghommo guLLeyo, tikkeyo kerasunu",தீபாவளியின் போது பலர் வீட்டில் இனிப்புகள் மற்றும் கார வகைகளை தயார் செய்வார்கள்,"During Diwali, many people prepare sweets and savouries at home"
நெக்3கு3ன்,neggun,பலகாரம்,Snacks,தெ3ளெ பீடும் கெரெ நெக்3கு3ன் போடுக் சோட் ந்ஹா,deLe peeTum kere neggun pOTuk cOT nhaa,கடலை மாவில் செய்த பலகாரங்கள் வயிற்றுக்கு நல்லதல்ல,Snacks made from Gram flour are not good for the stomach
ப4ஜ்ஜி,bhajji,பஜ்ஜி,Banana Fritters (Bajji),ப4ஜ்ஜி மெனெத் தெல்லெ கச்செகெளா ப4ஜ்ஜிஸீ,bhajji menet telle kaccekeLaa bhajjisee,பஜ்ஜி என்றால் அது வாழைக்காய் பஜ்ஜி தான்,Bajji means banana fritters only
வடொ3,vaDo,வடை,"donut, doughnut",எல்லெ கேளுபூ2ல் வடொ3. க2யி ஸவொ !!,elle kELuphool vaDo. khayi savo !!,இது வாழைப்பூ வடை. சாப்பிட்டு பாருங்கள் !!,This is banana blossom vada. Taste it !!
ஆம்ப3டொ3,aambaDo,மசால்வடை,"Spicy donut, doughnut",குத்தலம் மெனெத் ஆம்ப3டொ3கின் சாய் ஹவ்ட3ன் அவஸ்,kuttalam menet aambaDokin caay havDan avas,குற்றாலம் என்றால் மசால் வடையும் தேநீரும் நினைவுக்கு வருகிறது,Courtalam brings to mind masala vada and tea
மீடு3 வடொ3,meeDu vaDo,மெதுவடை,"Flour donut, doughnut",பெ3ங்க3ளூரும் மீடு3 வடொ3 ம்ஹொட்டொ ர்ஹாயி,benggaLoorum meeDu vaDo mhoTTo rhaayi,பெங்களூரில் மெதுவடை பெரிதாக இருக்கும்,Medu vada is big in Bangalore
கு3ள்ளு வடொ3,guLLu vaDo,வெல்ல வடை,"Jaggery donut, doughnut",பொருங்கிடி3 கு3ள்ளு வடொ3 பெ4ளி ருசிகன் ஸே,porungkiDi guLLu vaDo bheLi rucikan sE,பரமக்குடி வெல்ல வடை மிக சுவையாக இருக்கிறது,Paramakkudi jaggery donut is very tasty
ஸுகு3ண்டொ3,suguNDo,"போண்டா, சீயம், பணியாரம்",Steamed rice flour balls,"கு3ள்ளெயொ, திக்கெயொ மெனி தீ3 ப்ரகார் ஸுகு3ண்டா3ன் ஸே","guLLeyo, tikkeyo meni dee prakaar suguNDaan sE","இனிப்பு, காரம் என இரண்டு வகை போண்டாக்கள் உண்டு","There are two types of steamed rice balls, sweet and savory"
பகோடா3,pakODaa,பக்கோடா,Pakora,பொவ்ஸுவேள் ஹுன்னொகன் பகோடா3 க2யெத் ஶோப4னொகன் ர்ஹாய்,povsuvEL hunnokan pakODaa khayet ssObhanokan rhaay,மழையின் போது சூடாக பக்கோடா சாப்பிட்டால் அருமையாக இருக்கும்,Eating hot pakora during rain will be superb
ரொட்டி,roTTi,ரொட்டி,Bread,ஹிந்தா3 நாஸ்தொ ரொட்டிகின் பொள்ளா கெ3ஸி,hindaa naasto roTTikin poLLaa gesi,இன்றைய காலை உணவு பிரட் மற்றும் ஜாம்,Today's breakfast is bread and jam
பைடி3 ரொட்டி,paiDi roTTi,சிறிய ரொட்டி,Bun,பைடி3 ரொட்டிக் லொனிகின் பொள்ளா கெ3ஸி ஸெரொ கா2ஸுன்,paiDi roTTik lonikin poLLaa gesi sero khaasun,பன்னை வெண்ணெய் மற்றும் ஜாம் உடன் சாப்பிடுகிறார்கள்,Bun is eaten with butter and jam
"பொள்ளா கெ3ஸி, பொள்ளா பி3ஜ்ஜட்","poLLaa gesi, poLLaa bijjaT",பழ ஊறல்,Jam,"பொள்ளானுக் வடி3, தப்படி3, கெ4டி3 பொட3டி பொள்ளா கெ3ஸி கெரஸுன்","poLLaanuk vaDi, tappaDi, gheDi poDaTi poLLaa gesi kerasun","பழங்களை அரைத்து, வேகவைத்து, கெட்டியாக்கி பழ ஊறல் செய்கிறார்கள்","Fruit jam is made by grinding, boiling and thickening the fruits"
சைலி,caili,முறுக்கு,Twisted crunchy Snack,கச்சென்னா பீட் ஸொம்மர் தந்து3 பீடு3ம் கெரெ சைலி ப3ரொ,kaccennaa peeT sommar tandu peeDum kere caili baro,கடலை மாவை விட அரிசி மாவில் செய்த முறுக்கு நல்லது,Murukku made with rice flour is better than gram flour
தெந்து3லொ,tendulo,முறுக்கு,Crunchy snack,ஹொராடு3 ப2லார் தெந்து3லொ ம்ஹொட்டொ ர்ஹாயி,horaaDu phalaar tendulo mhoTTo rhaayi,கல்யாண சீர் முறுக்கு பெரியதாக இருக்கும்,Marriage gift Murukku will be big
புரி,puri,அதிரசம்,"Sweet donut, Adhirasam",தெந்து3லொகின் புரி அவ்ரெ நெக்3கு3னு,tendulokin puri avre neggunu,முறுக்கும் அதிரசமும் சௌராஷ்டிரர்களின் தின்பண்டங்கள்,Murukku and Adhirasam are Sourashtrian's snacks
கந்து3லொ,kandulo,கொழுக்கட்டை,Rice dumplings,விநாயிக் கந்து3லொ அர்பணொ கெரஸுன்,vinaayik kandulo arpaNo kerasun,விநாயகப் பெருமானுக்கு கொழுக்கட்டை படைப்பார்கள்,Rice dumplings are offered to Lord Ganesha
தொ4வ்ளொ,dhovLo,பால் கொழுக்கட்டை,Milk Dumplings,தொ4வ்ளாக் கஸ்தந்து3 பீடும் கெரி தூ3து3ம் பி3ஜ்ஜட3னு,dhovLaak kastandu peeTum keri doodum bijjaDanu,பால் கொழுக்கட்டையை பச்சரியில் செய்து பாலில் ஊறவைப்பார்கள்,Milk dumpling is made in raw rice and soaked in milk
பொ2ன்னிந்தொ4வ்ளொ,phonnindhovLo,சீரக கொழுக்கட்டை,Cumin rice dumplings,பொ2ன்னிந்தொ4வ்ளொ கொ2வ்லாக் சொக்கடு3,phonnindhovLo khovlaak cokkaDu,சீரக கொழுக்கட்டை இருமலுக்கு நல்லது,Cumin rice dumpling is good for cough
ஸெவி,sevi,நீட்டு கொழுக்கட்டை,Dumpling Roll,ஸெவி பி3ஜ்ஜெ தூ3து3 பேஸ் கு3ள்ளெகன் ருசிகன் ர்ஹாயி,sevi bijje doodu pEs guLLekan rucikan rhaayi,"கொழுக்கட்டை ஊறிய பால் கஞ்சி இனிப்பாக, சுவையாக இருக்கும்",Dumpling roll soaked milk porridge is sweet and delicious
பஸெம்,pasem,பாயசம்,Rice Pudding,நிளமு பெ3ளா பஸெம் தடொ3வொன்னு ர்ஹாயி,niLamu beLaa pasem taDovonnu rhaayi,பச்சைப்பயறு பாயாசம் தண்ணீராக இருக்கும்,Green gram rice pudding is watery
ஹல்வொ,halvo,அல்வா,Halva,கோழிக்கோடு3 ஹல்வா வேன் ப்ரஸித்3தி4 ஹொயெயொ,kOzhikkODu halvaa vEn prasiddhi hoyeyo,கோழிக்கோடு அல்வா மிகவும் பிரபலமானது,The Kozhikode Halwa is very popular
கெஷாவ்,keshaav,கஷாயம்,Potion,தி3வளி நெக்3கு3ன் ஜீர்ணு ஹோத்தக் கெஷாவ் பெனொ,divaLi neggun jeerNu hOttak keshaav peno,தீபாவளி பலகாரங்கள் செரிக்க கசாயம் குடிக்கவேண்டும்,Drink potion to digest Diwali snacks
பேஸ்,pEs,கஞ்சி,"Porridge, Gruel, Pulp, Mush",ஶிம்பு3 பீடும் கெரெ பேஸ் பில்லல்னுக் சொக்கடு3,ssimbu peeTum kere pEs pillalnuk cokkaDu,தானிய மாவில் செய்த கஞ்சி குழந்தைகளுக்கு நல்லது,Porridge made from grain flour is good for children
வெளெபேஸ்,veLepEs,வடிகஞ்சி,"Boiled rice water, Rice Porridge",மலையாளின் வெளெபேஸும் மீட் தகி3லி பேஸூன்,malaiyaaLin veLepEsum meeT tagili pEsoon,மலையாளிகள் வடிகஞ்சியில் உப்பு போட்டு குடிப்பார்கள்,Malayalis drink rice porridge with salt
து4வன்,dhuvan,"அரிசி கழுவிய தண்ணீர், கழனி தண்ணீர்","Rice rinsed water, Rice washed water",து4வனு பனி கா3ய்கொ3ருனுக் தே3ஸுன்,dhuvanu pani gaaygorunuk dEsun,கழனித் தண்ணீர் கால்நடைகளுக்கு கொடுப்பார்கள்,Rice rinsed water is fed to cattles
கொடு3க்,koDuk,"மிளகு மஞ்சள் கலந்த கஞ்சி, காரகஞ்சி",Spicy Gruel,அத்தொ கொடு3க் பெனார் ஸேயா?,atto koDuk penaar sEyaa?,இப்போது காரகஞ்சி குடிப்பவர்கள் உண்டா?,Are there any spicy gruel drinkers now?
முற்கெ3,murge,"அழுகின, அழுகிய, சிதைந்த","Rotten, Decomposed",பொள்ளாம் ர்ஹீ முற்கெ3 வஸுனொ அவரஸ்,poLLaam rhee murge vasuno avaras,பழத்திலிருந்து அழுகிய வாசனை வருகிறது,A rotten smell comes from the fruit
முட3த்தெ,muDatte,"அழுகுதல், சிதைதல்","Rot, Decompose",பொள்ளானுக் முட3த்தக் ஸொட்3னகொ3 !,poLLaanuk muDattak soDnago !,பழங்களை அழுக விடாதே !,Do not let the fruits rot !
முடி3னி (தூ3த்),muDini (doot),"திரிந்துபோதல் (பால்), கெட்டுப்போதல்","Spoilage (milk), Decomposition",ஹூனுகலமு தூ3த் ப4ராட் தொவெத் முட்3ஜாயி,hoonukalamu doot bharaaT tovet muDjaayi,வெயில்காலத்தில் பாலை வெளியில் வைத்தால் திரிந்துவிடும்,Milk gets spoiled if left outside in summer
விட்டய,viTTaya,ஊசிப்போன,"Spoilt, Rotten, Stale",விட்டய பா4த் ஸுனொ மெல்லொ கா2னா,viTTaya bhaat suno mello khaanaa,ஊசிப்போன சாதத்தை நாய் கூட சாப்பிடாது,Even the dog will not eat the rotten rice
நஜ்ஜெ,najje,கெட்டுப்போன,"Spoilt, Rotten, Stale",நஜ்ஜெ பு4ர்கொ தகெத் அவ்ண்டி கொடு3 லக3ய்,najje bhurko taket avNTi koDu lagay,கெட்டுப்போன பொடி போட்டால் குழம்பு கசக்கும்,"If you use spoiled powder, the broth will taste bitter"
ரெஸ்ஸு,ressu,சாறு,"Juice, Soup",ஸெக்கர் ரோக்3 கெரின் பொள்ளா ரெஸ்ஸு பே ஹோனா,sekkar rOg kerin poLLaa ressu pE hOnaa,சர்க்கரை நோயாளிகள் பழச்சாறு குடிக்கக் கூடாது,Diabetics should not drink fruit juice
குட்கொ,kuTko,துண்டு,Piece,ஸெவாக்கய்லாக் சர்பாஞ்சு குட்கொகன் காட்,sevaakkaylaak carpaanjcu kuTkokan kaaT,முருங்கைக்காயை நான்கைந்து துண்டுகளாக நறுக்கவும்,Cut the drumstick into four to five pieces
நலாபனி,nalaapani,குழாய் நீர்,Tap Water,நலாபனி சொக்கட் ருசிகன் ஸே,nalaapani cokkaT rucikan sE,குழாய் நீர் நல்ல சுவையாக உள்ளது,Tap water tastes good
கா2ன்பான்ஶாலொ,khaanpaanssaalo,உணவகம்,"Restaurant, Hotel",கண்ணா கா2ன்பான்ஶாலாம் ராஜ்ஜெமன் ருசிகன் ர்ஹாயி,kaNNaa khaanpaanssaalaam raajjeman rucikan rhaayi,கண்ணன் உணவகத்தில் இரவு உணவு சுவையாக இருக்கும்,The dinner at Kannan restaurant is delicious
வஸனுஶாலொ,vasanussaalo,தங்கும் விடுதி,"Lodge, Hostel",எல்லெ வஸனுஶாலாம் 500 பொ2வ்னான் வஸன் கெருவாய்,elle vasanussaalaam 500 phovnaan vasan keruvaay,இந்த தங்கும் விடுதில் 500 விருந்தினர்கள் தங்கலாம்,This hotel can accommodate 500 guests
நெட்ஷத்ரு வஸனுஶாலொ,neTshatru vasanussaalo,நட்சத்திர விடுதி,Star Hotel,நெட்ஷத்ரு வஸனுஶாலாம் கொனேவெள காப்பி அப்3ப3யி,neTshatru vasanussaalaam konEveLa kaappi abbayi,நட்சத்திர ஓட்டலில் எந்நேரமும் காபி கிடைக்கும்,Coffee is available anytime at Star Hotel
தாடி3 பனி,taaDi pani,கள்ளு,Toddy,அம்ப3ட் பொட்3னா தாடி3 பனி போடு3க் சொக்கட் மெனன்,ambaT poDnaa taaDi pani pODuk cokkaT menan,புளிக்காத கள் வயிற்றுக்கு நல்லது என்பார்கள்,Unfermented toddy is said to be good for the stomach
கெள்ளு,keLLu,கள்ளு,Toddy,கெள்ளு விக்கத்தெ ஏட் ப3ந்தி3 கெர்திரியொ,keLLu vikkatte ET bandi kertiriyo,இங்கு கள் விற்பது இங்கு தடை செய்யப்பட்டுள்ளது,Selling toddy is prohibited here
ஸெரொ,sero,"சாராயம், பட்டைச் சாராயம்","Arrack, Liquor, Drinks, Alcohol, Spirit",ஸெரொ பேத்தெ நஜ்ஜெ வட்கெ,sero pEtte najje vaTke,சாராயம் குடிப்பது கெட்ட பழக்கம்,Drinking arrack is a bad habit
ஸெரா பனி,seraa pani,"மதுபானம், போதை பானம்","Hot drinks, Drinks, Arrack, Liquor, Alcohol, Spirit",ஸெரா பனி களஜ்ஜிக் பா3தொ3 கெரய்,seraa pani kaLajjik baado keray,மதுபானம் கல்லீரலை பாதிக்கும்,Alcohol affects the liver
பெனிஶாலொ,penissaalo,மதுக்கூடம்,Bar,அத்தொ அஸ்கி பெ3ய்லனுக் மெனி பெத்தே பெனிஶாலொ ஸே,atto aski beylanuk meni pettE penissaalo sE,இப்போதெல்லாம் பெண்களுக்கென தனி மதுக்கூடம் உள்ளது,Nowadays there is a separate bar for women
பனி தய்லத்தெ,pani taylatte,மது அருந்துதல்,Boozing,பனி தய்லி பொ3ண்டி3 தொ3வ்ட3த்தெ விபத் ஹொயெயொ,pani tayli boNDi dovDatte vipat hoyeyo,குடித்துவிட்டு வண்டி ஓட்டுவது அபாயமானது,Drunk driving is dangerous
பெனி,peni,மது அருந்துதல்,Boozing,பெனிக் பொள்கி3ள்டி3யத் ஸொட3ன் முஸுனா,penik poLgiLDiyat soDan musunaa,மது அருந்த பழகிவிட்டால் விட முடியாது,"Once you get used to drinking alcohol, you can't quit"
மொதொ3,modo,போதை,Intoxication,பனி தய்லியெத் மொதொ3 அவயி,pani tayliyet modo avayi,மது அருந்தினால் போதை ஏறும்,Drinking alcohol causes intoxication
கு3ள்ளெ பனி,guLLe pani,குளிர்பானம்,"Soft drinks, Beverage",கு3ள்ளெ பனிக் ஸில்லொகன் பெனொ,guLLe panik sillokan peno,குளிர்பானங்களை குளிர்ச்சியாக குடிக்க வேண்டும்,Soft drinks should be drunk cold
நொம்மத்தெ,nommatte,மெல்லுதல்,Chewing,தோனும் காய் நொம்மரியோ?,tOnum kaay nommariyO?,வாயில் என்ன மெல்லுகிறீர்கள் ?,What are you chewing in mouth?
நஜ்ஜனாத்தொ ஸீலெ,najjanaatto seele,"கெடாது பேணு, பாதுகாக்க",Preserve,ஹலது பு4ர்கொ நஜ்ஜனாத்தொ ஸீலுனொ,halatu bhurko najjanaatto seeluno,மஞ்சள் தூள் கெடாது பாதுகாக்கப்பட வேண்டும்,Turmeric powder should be preserved
கலம்ஹொனி,kalamhoni,காலாவதி,Expire,கலம்ஹொயெ சீடிகாம் ப்ரயாண் கெரானா,kalamhoye ceeTikaam prayaaN keraanaa,காலாவதியான சீட்டில் பயணம் செய்ய முடியாது,You cannot travel on an expired ticket
கலம்ஹோன்ஜாரியொ,kalamhOnjaariyo,காலாவதியாகும்,Expiry,க2ட3த்தக் முது3ல்லாம் கலம்ஹோன்ஜாரியொ தி3னாங்குக் ஸெர்க்கொ ஸனொ,khaDattak mudullaam kalamhOnjaariyo dinaangkuk serkko sano,வாங்குவதற்கு முன் காலாவதி தேதியை சரிபார்க்கவும்,Check the expiry date before buying
பொட்ணம்,poTNam,பொட்டலம்,"Parcel, Pack",கா2ன்பான்ஶாலாம் ப2லார் பொட்ணம் ப4ந்தி3 தே3ராஸ்,khaanpaanssaalaam phalaar poTNam bhandi dEraas,ஹோட்டலில் இட்லியை பொட்டலம் கட்டி தருகிறார்கள்,"At the hotel, they pack the idli"
தெத்துளிஞ்ஜத்தெ,tettuLinjjatte,தள்ளாடுதல்,Stagger,ஜு2க்கு ப2லார் க2யெஹால் தெனு தெத்துளிஞ்ஜாஸி,jhukku phalaar khayehaal tenu tettuLinjjaasi,அதிகமாக இட்லி சாப்பிட்டதால் அவர் தள்ளாடினார்,He staggered because he ate too much Idli
