alias_tamil,alias_english,tamil,english,alias_tamil_sentence,alias_english_sentence,tamil_sentence,english_sentence
லொஷ்டொ,loshTo,புதினா துவையல்,Mint curry,"ப2லார், தி4டொ3 ஸெராடி3 லொஷ்டொ தொ2வ்லி கா2ஸுனு","phalaar, dhiDo seraaDi loshTo thovli khaasunu","இட்லி, தோசையுடன் புதினா துவையலை வைத்து சாப்பிடுகிறார்கள்",People take mint curry with idli and dosa
கெ3ஸி,gesi,ஊறுகாய்,Pickle,தெ4ய்ஞ் பா4த் ஸெரொ காய் கெ3ஸி பயெத் தொ2வ்லுவாய்,dheynj bhaat sero kaay gesi payet thovluvaay,தயிர் சாதத்துடன் எந்த ஊறுகாயையும் வைத்துக்கொள்ளலாம்,You can have any pickle with curd rice
பு4டி3த்,bhuDit,மசியல்,Mash,பு4டி3த் மெனத் தெல்லெ வங்கி3 பு4டி3தூஸ்,bhuDit menat telle vanggi bhuDitoos,மசியல் என்றால் அது கத்தரிக்காய் மசியல் தான்,Mash means it is mashed brinjal only
வங்கி3 பு4டி3த்,vanggi bhuDit,கத்தரிக்காய் மசியல்,"Mashed brinjal, Mashed Eggplant",ஜெமனும் பொங்க3ல் ஸெரொ வங்கி4 பு4டி3த் தொ2வஸுனு,jemanum ponggal sero vangghi bhuDit thovasunu,விருந்தில் பொங்கலுடன் கத்தரிக்காய் மசியல் வைப்பார்கள்,"In the feast, mashed brinjal is served with Pongal"
க4டி3னி,ghaDini,கடையல்,"Churning Spinach etc.,",ப4ஜ்ஜி க4டி3னி ந்ஹன்ன பில்லல்னுக் சொக்கடு3,bhajji ghaDini nhanna pillalnuk cokkaDu,கீரை கடையல் சிறு குழந்தைகளுக்கு நல்லது,Churned spinach is good for small children
"ஸிஜ்வெத்தெ, ஸிவ்ஜத்தெ","sijvette, sivjatte",வேகவைத்தல்,Boiling,ஹந்த3த்தக் முது3ல்லொ பூ2லுகோ3பி3க் ஸிஜ்வத்தெ ப3ரொ,handattak mudullo phoolugObik sijvatte baro,சமைப்பதற்கு முன் காலிஃபிளவரை வேகவைப்பது நல்லது,It is better to boil cauliflower before cooking
பொ2ன்னி தே3த்தெ,phonni dEtte,தாளித்தல்,"Seasoning, Garnishing",பொ2ன்னி தெ3னிம் ஜு2கு3 ஹிதௌவுன் ஸே,phonni denim jhugu hitauvun sE,தாளிப்பதில் நிறைய நன்மைகள் உள்ளன,Seasoning has many benefits
கூ2ர்,khoor,நெடி,Pungent smell,ல்ஹொவொ மிர்க்கைலா கூ2ர் வேன் ஸே,lhovo mirkkailaa khoor vEn sE,சிவப்பு மிளகாயின் நெடி அதிகமாக இருக்கிறது,The red chilli is smelling very pungent
ஒடி3,oDi,அரிசி வடகம்,"Fried rice ball, Rice vadakam",பா4து3 ஒடி3 கெர்ன மெனெத் காம் லம்பொ3 உட்சயி,bhaadu oDi kerna menet kaam lambo uTcayi,அரிசி வடகம் செய்யவேண்டும் என்றால் வேலையை நீட்டி இழுக்கும்,Making fried rice ball prolongs the work
அப்புடா3ல்,appuDaal,அப்பளம்,Papad,பில்லல்னுக் அப்புடா3ல் ஜு2க்கு ஒப்பாயி,pillalnuk appuDaal jhukku oppaayi,குழந்தைகளுக்கு அப்பளம் மிகவும் பிடிக்கும்,Children like papad very much
பொ4ஸுலொ,bhosulo,"இறைச்சி, மாமிசம், கறி, அசைவம்","Meat, Non-veg",பொ4ஸுலாக் வர்ஜத்தெ ப3ரொ,bhosulaak varjatte baro,மாமிசத்தை தவிர்ப்பது நல்லது,It is better to avoid meat
சைனொ,caino,"இறைச்சி, மாமிசம், கறி, அசைவம்","Meat, Non-veg",புரட்டாஸி ம்ஹடா3ம் கோன் சைனொ கா2ன்?,puraTTaasi mhaDaam kOn caino khaan?,புரட்டாசி மாதத்தில் யார் கறி சாப்பிடுவார்கள்?,Who eats meat in Puratasi month?
குடி3 சைனொ,kuDi caino,கோழி இறைச்சி,Chicken meat,கென்டக்கி பு4ஞ்ஜெ குடி3 சைனொ நாவ் பொடெ3யொ,kenTakki bhunjje kuDi caino naav poDeyo,கென்டக்கி வறுத்த கோழி இறைச்சி பிரபலமானது,Kentucky fried chicken is popular
பெ4ண்டு3 சைனொ,bheNDu caino,ஆட்டிறைச்சி,Mutton,தெகொ3 பெ4ண்டு3 சைனொ ஜு2க்கு ஒப்பாயி,tego bheNDu caino jhukku oppaayi,அவனுக்கு ஆட்டிறைச்சியை மிகவும் பிடிக்கும்,He likes to eat mutton which was seasoned with garlic
கொ3ரு சைனொ,goru caino,மாட்டிறைச்சி,Beaf,கொ3ரு சைனொ க2யி தூ தெ3ள்கொ பொள்டி3ரஸ்,goru caino khayi too deLko poLDiras,மாட்டுக்கறி சாப்பிட்டு நீ குண்டாகி விட்டாய்,You have gained weight by eating beef
து3க்கரு சைனொ,dukkaru caino,பன்றி இறைச்சி,Pork,தெ2வ்டெ3 தெ4ருமு து3க்கரு சைனொ அஸுத்3த4ம் மெனி மென்லஸுனு,thevDe dherumu dukkaru caino asuddham meni menlasunu,"சில மதங்களில், பன்றி இறைச்சி தூய்மையற்றதாக கருதப்படுகிறது","In some religions, pork is considered impure"
ஹரிணு சைனொ,hariNu caino,மான் இறைச்சி,Venison,பா4ரதும் ஹரிணு சைனொ கா2த்தெ அபராத்4 ஹோஸு,bhaaratum hariNu caino khaatte aparaadh hOsu,இந்தியாவில் மான் கறி சாப்பிடுவது குற்றம் ஆகும்,Eating venison is a crime in India
மெயம்,meyam,கொழுப்பு,Fat,து3க்கரு சைனாம் மெயம் வேன் ஸே,dukkaru cainaam meyam vEn sE,பன்றி இறைச்சியில் அதிக கொழுப்பு உள்ளது,Pork is high in fat
மந்தொ3,mando,கொழுப்பு,Fat,குளித் க2யெத் மந்தொ3 உன்னொ பொட3யி,kuLit khayet mando unno poDayi,கொள்ளு சாப்பிட்டால் கொழுப்பு குறையும்,Eating horse gram reduces fat
அண்டொ3,aNDo,முட்டை,Egg,குடி3 ஒண்டெ தி3ன்னுக் ஒண்டெ அண்டொ3 தக3யி,kuDi oNTe dinnuk oNTe aNDo tagayi,கோழி ஒரு நாளுக்கு ஒரு முட்டை இடும்,A hen lays one egg per day
கொட்3டி3,koDDi,கருவாடு,Dried fish,கொட்3டி3 ஜு2கு3 தி3ன்னு நஜ்ஜனாத்தக் ர்ஹாஸு,koDDi jhugu dinnu najjanaattak rhaasu,கருவாடு நீண்ட நாட்கள் கெடாமல் இருக்கும்,Dried fish will last longer
ஸுக்கட்,sukkaT,உப்புக்கண்டம்,"Dry mutton, Jerky",ஸுக்கட் ப்ராமொபொடி3 க2னார் ஜு2கு3 தெனு ஸே,sukkaT praamopoDi khanaar jhugu tenu sE,உப்புக்கண்டத்தை விரும்பி சாப்பிடுபவர்கள் நிறைய பேர் உண்டு,There are many people who like to eat dry mutton
"சகுலத்தெ, சைலத்தெ","cakulatte, cailatte","வெஞ்சனம், தொட்டுக்கொள்ளல்",Side dish,சைலத்தக் ந்ஹாத்தக் கா2த்த முஸய்யா?,cailattak nhaattak khaatta musayyaa?,தொட்டுக்கொள்ள இல்லாமல் சாப்பிட முடியுமா?,Can you eat without side dish?
பீட்,peeT,மாவு,Batter,அங்கி3டி3ம் க2ட3ரியொ பீடும் அம்ப3ட் வேன் ர்ஹாஸ்,anggiDim khaDariyo peeTum ambaT vEn rhaas,கடையில் வாங்கும் மாவில் அதிக புளிப்பு உள்ளது,Store-bought batter is highly leavened
அப்பம்,appam,கருப்பட்டி ஆப்பம்,Jaggery dosa,தெ2வ்டெ3 தெனு நாஸ்தாக் அப்பம் கா2ஸுன்,thevDe tenu naastaak appam khaasun,சிலர் காலை உணவிற்கு ஆப்பம் சாப்பிடுகிறார்கள்,Some eat jaggery dosa for breakfast
லொனி அப்பம்,loni appam,வெண்ணை ஆப்பம்,Buttered jaggery dosa,லொனி அப்பம் ஹுன்னொ ஹுன்னொகன் க2னொ,loni appam hunno hunnokan khano,வெண்ணை ஆப்பத்தை சுடச்சுட சாப்பிடவேண்டும்,Buttered jaggery dosa should be eaten hot
தி4டொ3,dhiDo,தோசை,"Dosa, Rice Pancake",கொம்மன் பீடும் ஹந்தெ3 தி4டொ3 ருசி ர்ஹானா,komman peeTum hande dhiDo ruci rhaanaa,புளிக்காத மாவில் வார்த்த தோசை சுவையாக இருக்காது,Dosa made in unleavened batter is not tasty
கோ4ம தந்து3 தி4டொ3,ghOma tandu dhiDo,கோதுமை தோசை,"Wheat dosa, Wheat rice Pancake",கோ4ம தந்து3 தி4டொ3 நிவயத் சோட் ர்ஹானா,ghOma tandu dhiDo nivayat cOT rhaanaa,கோதுமை தோசை ஆறினால் நன்றாக இருக்காது,Wheat dosa is not good when cold
ப2லார்,phalaar,இட்லி,"Idli, Idly, Rice Cake",கொன்னி பில்லல்னுக் ப2லார் ஒப்பானி,konni pillalnuk phalaar oppaani,எந்த குழந்தைக்கும் இட்லி பிடிப்பதில்லை,No child likes Idli
விள்டியொ,viLTiyo,இட்லி,"Idli, Idly, Rice Cake",ஆங்கு3ஹுன்னாக் விள்டியோஸ் மேட்ஹொயெ அகா3ரு,aangguhunnaak viLTiyOs mEThoye agaaru,காய்ச்சலுக்கு இட்டிலியே சிறந்த உணவு,Idli is the best food for fever
விள்டொ3டு3ம்,viLDoDum,இட்லி,"Idli, Idly, Rice Cake",ரொவ்வொ தமஸ் பொடி3 ஜியெத் அங்கி3டி3ம் விள்டொ3டு3ம் அப்3ப3னி,rovvo tamas poDi jiyet anggiDim viLDoDum abbani,சற்று தாமதமாக சென்றால் கடையில் இட்லி கிடைப்பதில்லை,"If we go a little late, we will no get idli in the shop"
உக்குடு3ம்,ukkuDum,இட்லி,"Idli, Idly, Rice Cake",தீ2ன் பூட் ஜெமனும் உக்குடு3ம் ந்ஹாத்தக் ர்ஹானா,theen pooT jemanum ukkuDum nhaattak rhaanaa,மூன்று வேளை விருந்தில் இட்லி இல்லாமல் இருக்காது,A three-course feast cannot be without idlis
தொ2வ்லி ப2லார்,thovli phalaar,சட்டி இட்லி,"Clay pot Idli, Idly, Rice cake",தொ2வ்லி ப2லார் ஒண்டொண்டெ தி4டொ3 ஸேரு ர்ஹாய்,thovli phalaar oNToNTe dhiDo sEru rhaay,சட்டி இட்லி ஒன்றொன்றும் தோசை அளவுக்கு இருக்கும்,Each clay pot Idli will be about the size of Dosa
பு4ர்கொ,bhurko,பொடி,Powder,தி4டொ3 ஸெரொ பு4ர்கொகின் தேல் ருசிகன் ர்ஹாயி,dhiDo sero bhurkokin tEl rucikan rhaayi,தோசையுடன் பொடியும் எண்ணையும் சுவையாக இருக்கும்,Powder and oil with dosa is also delicious
பு4ர்க்கொ,bhurkko,"சிறு துண்டு, பொடியாக","Into small pieces, Chopping finely, Mincing",பொ3ந்தெ3க் சொக்கட் பு4ர்க்கொகன் காட்,bondek cokkaT bhurkkokan kaaT,வாழைத்தண்டை நன்கு பொடியாக நறுக்கவும்,Finely chop the banana stem
முத்3தா3 பொங்க3ல்,muddaa ponggal,வெண் பொங்கல்,Rice cooked with lentils,முத்3தா3 பொங்க3ல் க2னாத்தெனு கோன்தி ஸேயா?,muddaa ponggal khanaattenu kOnti sEyaa?,பொங்கல் சாப்பிடாதவர்கள் யாராவது உண்டா?,Is there anyone who have not eaten Pongal?
தூப் பொங்க3ல்,toop ponggal,நெய் பொங்கல்,Ghee Pongal,தூப் பொங்க3ல் வேன் க2யெத் ஹோங்கு3 அவய்,toop ponggal vEn khayet hOnggu avay,நெய் பொங்கல் அதிகம் சாப்பிட்டால் தூக்கம் வரும்,"If you eat a lot of Ghee Pongal, you will feel sleepy"
"கேஸரி, உப்மாவ்","kEsari, upmaav","கேசரி, உப்புமா","Kesar bath, Uppuma","கேஸரி, உப்மாவ் தி3ய்யொ கென்னிம் கெரயொ","kEsari, upmaav diyyo kennim kerayo","கேசரி, உப்புமா இரண்டுமே ரவையில் செய்யப்பட்டவை",Both Kesari and Uppuma were made in semolina
அம்ப3ட் பா4த்,ambaT bhaat,புளியோதரை,Tamarind Rice,தீ3தி3 ஹொயெத் மெல்லொ அம்ப3ட் பா4த் விட்டானா,deedi hoyet mello ambaT bhaat viTTaanaa,இரண்டு நாளானாலும் புளியோதரை ஊசிப் போகாது,Tamarind rice does not spoil even for two days
லிம்பு3 பொங்க3ல்,limbu ponggal,எலுமிச்சைசாதம்,Lemon Rice,அம்ப3ட் பா4த் ஸேரு லிம்பு3 பொங்க3லுக் காம் ஹொட்3னா,ambaT bhaat sEru limbu ponggaluk kaam hoDnaa,புளியோதரை அளவுக்கு எலுமிச்சம் சாதத்திற்கு வேலை வளராது,Lemon rice requires less work than tamarind rice
தக்காளி பொங்க3ல்,takkaaLi ponggal,தக்காளி சாதம்,Tomato rice,தக்காளி பொங்க3ல் கெர்ராஸி ! காய் விஶேஷ் ?,takkaaLi ponggal kerraasi ! kaay vissEsh ?,தக்காளி சாதம் செய்திருக்கிறீர்கள் ! என்ன விசேஷம் ?,You have made tomato rice! What's special?
கு3ள்ளு பொங்க3ல்,guLLu ponggal,சர்க்கரை பொங்கல்,Sweet Pongal,கு3ள்ளு பொங்க3ல் நிவயெத்திக்காம் து3ஸுரொ ருசி தே3ஸு,guLLu ponggal nivayettikkaam dusuro ruci dEsu,சர்க்கரை பொங்கல் ஆறியதும் வேறு சுவை தருகிறது,It is a different taste when the sweet Pongal is cooled
ஸெக்கரு பொங்க3ல்,sekkaru ponggal,சீனி சர்க்கரை பொங்கல்,Sugar Pongal,ஸெக்கரு பொங்க3லும் கு3ள்ளுக் பொ3து3லு ஸெக்கர் தக3ஸுனு,sekkaru ponggalum guLLuk bodulu sekkar tagasunu,சர்க்கரை பொங்கலில் வெல்லத்திற்கு பதிலாக சீனி போடுவார்கள்,"In Sugar Pongal, Sugar is added instead of jaggery"
தௌ4ரா பொங்க3ல்,dhauraa ponggal,கோவில் பொங்கல்,Temple Pongal,தௌ4ரா பொங்க3ல் அவ்ரெதெங்கா3 விஶேஷுயொ,dhauraa ponggal avretenggaa vissEshuyo,கோவில் பொங்கல் சௌராஷ்டிரர்களின் சிறப்பு,Temple pongal is a specialty of Sourashtrians
தெ4ய்ஞ் பா4த்,dheynj bhaat,தயிர் சாதம்,Curd Rice,தெ4ய்ஞ் பா4துக் ரொவ்வொ மிரி அவ்ண்டி ஸொடு3யா?,dheynj bhaatuk rovvo miri avNTi soDuyaa?,தயிர் சாதத்திற்கு கொஞ்சம் மிளகு குழம்பு ஊற்றவா?,Shall I add little pepper gravy to curd rice?
பை4ரி,bhairi,பூரி,"Deep Fried Bread, Poori",பை4ரி வேன் க2யெத் க4டி3ம் தெலய்,bhairi vEn khayet ghaDim telay,பூரி அதிகம் சாப்பிட்டால் தொண்டையில் மிதக்கும்,Eating too much Poori can cause oily throat
சப்பாத்தி,cappaatti,சப்பாத்தி,Chapati,சப்பாத்தி சொக்கட் மெத்தன்கன் அவ்ரஸ்,cappaatti cokkaT mettankan avras,"சப்பாத்தி நன்றாக, மிருதுவாக வந்துள்ளது",The chapati has come out nice and crispy
"பரோட்டா, பு3ரோட்டா, பராத்தா","parOTTaa, burOTTaa, paraattaa","பரோட்டா, புரோட்டா, பராத்தா","Parota, Parotta, Paratha",அத்தொ கோட்தேட் திக்கெ பரோட்டா அப்3ப3ரஸ்,atto kOTtET tikke parOTTaa abbaras,இப்போது எங்கெங்கும் சில்லி பரோட்டா கிடைக்கிறது,Chilli Parotta is now available everywhere
பி3ரியாணி,biriyaaNi,பிரியாணி,"Biriyani, Briyani",பி3ரியாணி பா3ஸ்மதி தந்து3ம் ஹந்த3ஸுனு,biriyaaNi baasmati tandum handasunu,பிரியாணி பாஸ்மதி அரிசியில் சமைக்கிறார்கள்,Biryani is cooked in basmati rice
ரைதொ,raito,பச்சடி,Salad,பௌ4ளா ரைதொ மெது3டு3க் சொக்கடு3,bhauLaa raito meduDuk cokkaDu,சுரைக்காய் பச்சடி மூளைக்கு நல்லது,Zucchini tart is good for the brain
தெ4ய்ஞ் கந்தொ3,dheynj kando,வெங்காயபச்சடி,Onion Salad,பி3ரியாணி ஸெரொ குருமாகின் தெ4ய்ஞ் கந்தொ3 ஹொவ்ட3ஸுனு,biriyaaNi sero kurumaakin dheynj kando hovDasunu,பிரியாணியுடன் குருமாவையும் தயிர் பச்சடியையும் பரிமாறுகிறார்கள்,Biriyani is served with Kurma and onion salad
மஸாலா,masaalaa,"நறுமணப்பொருள், வாசனைத் திரவியம், மசாலா",Spice,"எளொ, லொம்பூ2ல், லவங்கொ3 எல்லெகா3க் மஸாலா மெனன்","eLo, lomphool, lavanggo ellegaak masaalaa menan","ஏலக்காய், கிராம்பு, லவங்கம் ஆகியவற்றை மசாலா என்பார்கள்","Cardamom, cloves and cinnamon are called spices"
குருமா,kurumaa,குருமா,"Kuruma, Kurma, Korma, Qorma",குருமாம் மஸாலா தகி3 நலர் வடி3 ஸொட3ஸுன்,kurumaam masaalaa tagi nalar vaDi soDasun,குருமாவில் மசாலா போட்டு தேங்காயை அரைத்து விடுவார்கள்,Spices and coconut paste are added to Kuruma
கொட்3டொ3,koDDo,"கெட்டியாக, கெட்டியான","Thick, Concentrated",பீட் கொட்3டொ3 ஸே. ரொவ்வொ பனி செர்ச்சி,peeT koDDo sE. rovvo pani cercci,மாவு கெட்டியாக உள்ளது சிறிது தண்ணிர் சேர்,The dough is thick. Add some water
பள்டொ,paLTo,"அரை திடம், நீர்த்து","Semi solid, Diluted, Watery",கென்னி பேஸ் பள்டொ ர்ஹாயி,kenni pEs paLTo rhaayi,நொய்க்கஞ்சி அரை திடமாக இருக்கும்,Rice porridge will be semi solid
தாடொ3,taaDo,தண்ணீராக,Watery,காப்பி ககொ3 இஸொ தாடொ3 ஸேத்தெ?,kaappi kago iso taaDo sEtte?,காபி ஏன் இப்படி தண்ணீராக இருக்கிறது?,Why is coffee so watery?
கெ4ட்டி,gheTTi,"திடம், கட்டி, கெட்டியாக, கெட்டியான","Solid, Hard, Thick, Concentrated",ஹிங்கு3 வேன் கெ4ட்டி ஸே,hinggu vEn gheTTi sE,பெருங்காயம் மிக கட்டியாக இருக்கிறது,Asafoetida is very solid
கெ4டி3 பொட3த்தெ,gheDi poDatte,"இறுகுதல், திடமாகுதல்","Solidify, Harden",காப்பி பு4ர்கொ கெ4டி3 பொள்ளிட்3ரஸ்,kaappi bhurko gheDi poLLiDras,காபித்தூள் கெட்டியாகி விட்டது,The coffee powder has hardened
தூ3த்,doot,பால்,Milk,துமி காய் தூ3த் வவ்ரரியொ?,tumi kaay doot vavrariyo?,நீங்கள் என்ன பால் பயன்படுத்துகிறீர்கள்?,What milk do you use?
ஸாய்,saay,பாலாடை,Creamy layer of milk,ஹுன்னொ தூ3த் நிவாத்தவேள் தெகொ3 ஹொல்லொ ஸாய் ப4ந்தா3ஸு,hunno doot nivaattavEL tego hollo saay bhandaasu,சூடான பால் குளிரும் போது அதன் மீது ஏடு உருவாகிறது,Skin forms on hot milk when it cools
சாய்,caay,தேநீர்,Tea,உத்தர் பா4ரதும் சாய் பெனார் வேனு,uttar bhaaratum caay penaar vEnu,வட இந்தியாவில் தேநீர் குடிப்பவர்கள் அதிகம்,North India has a large number of tea drinkers
காப்பி,kaappi,கொட்டைவடி நீர்,Coffee,நுரு ஸெரொ காப்பி பியெத் ருச்சிகன் லக3ஸு,nuru sero kaappi piyet ruccikan lagasu,நுரையுடன் காபி குடித்தால் சுவையாக இருக்கும்,Drinking coffee with foam is delicious
கு3ள்ளு காப்பி,guLLu kaappi,கருப்பட்டி காபி,Palm jaggery coffee,கு3ள்ளு காப்பி அத்தொ அஸ்கி தேட் அப்3ப3ரஸ்,guLLu kaappi atto aski tET abbaras,கருப்பட்டி காபி இப்போது எல்லா இடங்களிலும் கிடைக்கிறது,Palm jaggery coffee is now available everywhere
ஸொண்டி காப்பி,soNTi kaappi,சுக்கு காப்பி,Dried ginger coffee,பொஷ்ஷெக் ஸொண்டி காப்பி ஜு2க்கு சொக்கடு3,poshshek soNTi kaappi jhukku cokkaDu,ஜலதோஷத்திற்கு சுக்கு காபி மிகவும் நல்லது,Dried ginger coffee is very good for cold
மிடா2ய்,miThaay,மிட்டாய்,Candy,மிடா2ய் ஒப்பனாத்த பில்லல்னு ஸேயா?,miThaay oppanaatta pillalnu sEyaa?,மிட்டாய் பிடிக்காத குழந்தைகள் உண்டா?,Got kids who don't like candy?
