alias_tamil,alias_english,tamil,english,alias_tamil_sentence,alias_english_sentence,tamil_sentence,english_sentence
அகா3ர்,agaar,"உணவு, சாப்பாடு",Food,அகா3ர் ருசிகன் ஒண்டெ ந்ஹா ஹொக3த்கன் மெல்லொ ர்ஹனொ,agaar rucikan oNTe nhaa hogatkan mello rhano,சாப்பாடு சுவையாக மட்டுமல்ல மருந்தாகவும் இருக்க வேண்டும்,Food should not only be delicious but also medicinal
கௌ2ணம்,khauNam,"உணவு, சாப்பாடு",Food,பில்லன்னுக் தே3ரியொ கௌ2ணம் போஷணொகன் ர்ஹனொ,pillannuk dEriyo khauNam pOshaNokan rhano,குழந்தைகளுக்கு கொடுக்கப்படும் உணவு சத்தானதாக இருக்க வேண்டும்,Food given to children should be nutritious
நாஸ்தொ,naasto,காலை உணவு,Breakfast,ஹுரிக் ஜாரியொ பில்லல்னுன் நாஸ்தொ கெரனின்,hurik jaariyo pillalnun naasto keranin,பள்ளி செல்லும் குழந்தைகள் காலை உணவை சாப்பிடுவதில்லை,School going children do not eat breakfast
து4வாரி பா4த்,dhuvaari bhaat,மதிய உணவு,Lunch,து4வாரி பா4த் கா2த்தக் கோட் ஜியென்?,dhuvaari bhaat khaattak kOT jiyen?,மதிய உணவிற்கு எங்கு செல்லலாம்?,Where to go for lunch?
ஸ்தான்பான்,staanpaan,சிற்றுண்டி,Tiffin,வீள்டாக் ஸ்தான்பான் கெர்த்தி நிகு3ளுவாய்,veeLTaak staanpaan kertti niguLuvaay,மாலையில் சிற்றுண்டியை முடித்துவிட்டு கிளம்பலாம்,You can leave in the evening after taking tiffin
ராஜ்ஜெமன்,raajjeman,இரவு உணவு,"Supper, Dinner",ராஜ்ஜெமனுக் அவ்ரெ கே4ர் அவ்டு3வொ,raajjemanuk avre ghEr avDuvo,இரவு உணவிற்கு எங்கள் வீட்டிற்கு வந்துவிடுங்கள்,Come to our house for dinner
பூ4க்,bhook,பசி,Hunger,பூ4கும் ஹாத் பாய்ஞ் ஒண்ட்கரஸ்,bhookum haat paaynj oNTkaras,பசியால் கை கால் நடுங்குகிறது,Hands and feet tremble with hunger
போடுஞ்ஜாள்,pOTunjjaaL,பசி,Hunger,போடுஞ்ஜாள் அவெ ப2ரொ கா2த்தெ ப3ரொ,pOTunjjaaL ave pharo khaatte baro,பசி எடுத்த பிறகு சாப்பிடுவது நல்லது,It is better to eat after feeling hungry
பு4க்கொ,bhukko,"பசியுடன் இருப்பது, பட்டினி","Being hungry, Starvation",வாரும் ஒண்டால் பு4க்கொ ர்ஹாத்தெ சொக்கடு3,vaarum oNTaal bhukko rhaatte cokkaDu,வாரத்தில் ஒரு நாள் பட்டினி கிடப்பது நல்லது,It is good to starve one day a week
பு4க்லொ,bhuklo,பசித்தவர்,Hungry person,பு4க்லாக் ருசி களானா,bhuklaak ruci kaLaanaa,பசித்தவனுக்கு சுவை தெரியாது,A hungry person does not know taste
க2னார்,khanaar,சாப்பிடுபவர்,An eater,கய்லொகெஸுர் ஸொம்மர் பொ4ஸுலொ க2னார் வேன் ஹொய்யா,kaylokesur sommar bhosulo khanaar vEn hoyyaa,காய்கறிகளை விட மாமிசம் சாப்பிடுபவர்கள் அதிகமாகி விட்டனர்,Meat eaters have become more than vegetables
ப4க்ஷக்,bhakshak,உண்ணி,An eater,அஸ்கியொ கா2த்தெங்கொ3 ஸர்வ ப4க்ஷக் மெனன்,askiyo khaattenggo sarva bhakshak menan,அனைத்தையும் உண்ணுபவர்களை அனைத்துண்ணி என்பர்,Those who eat everything are called omnivores
ப4ஜ்ஜிக2னார்,bhajjikhanaar,சைவம் உண்பவர்,"Vegetarian, Veg",தெ2வ்டெ3 ப4ஜ்ஜிக2னாருன் அண்டொ3 கா2ஸுன்,thevDe bhajjikhanaarun aNDo khaasun,சில சைவ உணவு உண்பவர்கள் முட்டை சாப்பிடுவார்கள்,Some vegetarians eat eggs
பொ4ஸுலொக2னார்,bhosulokhanaar,அசைவம் உண்பவர்,"Non vegetarian, Non veg",தெ2வ்டெ3 பொ4ஸுலொக2னாருன் து3க்கரு சைனொ கா2னின்,thevDe bhosulokhanaarun dukkaru caino khaanin,சில அசைவ உணவு உண்பவர்கள் பன்றி இறைச்சியை உண்பதில்லை,Some non vegetarians do not eat pork
பூட்,pooT,ஒரு வேளை உணவு,One time meal,தீ2ன் பூட் பா4துக் இக்கொ கெஷ்டம் பொட்3ன ஹோஸ்,theen pooT bhaatuk ikko keshTam poDna hOs,மூன்று வேளை உணவுக்கு எவ்வளுவு கஷ்டப்பட வேண்டியுள்ளது,How much have to suffer for three meals
கா4ஸ்,ghaas,சோற்று உருண்டை,A big rice ball,தௌ4ராம் பொங்க3ல் ம்ஹொட்டொ கா4ஸ்கன் தே3ஸுன்,dhauraam ponggal mhoTTo ghaaskan dEsun,கோவிலில் பொங்கலை பெரிய உருண்டையாக கொடுப்பார்கள்,Pongal is served in a big ball in the temple
உண்டொ3,uNDo,உருண்டை,"Ball, Orb",தீளு உண்டா3க் அஸ்கி ஒர்ஸு கெரின் க2வாயி,teeLu uNDaak aski orsu kerin khavaayi,எள்ளு உருண்டையை அனத்து வயதினரும் சாப்பிடலாம்,People of all ages can eat sesame balls
பொ3ர்க்குலு உண்டொ3,borkkulu uNDo,பொரி உருண்டை,Puffed rice ball,பொ3ர்க்குலு உண்டா3க் பில்லல்னுன் ப்ராமொ பொடி3 கா2ஸுன்,borkkulu uNDaak pillalnun praamo poDi khaasun,பொரி உருண்டையை குழந்தைகள் விரும்பி சாப்பிடுவார்கள்,Children love to eat fried balls
பா4த்,bhaat,"சோறு, சாதம்",Cooked rice,அங்கு3 ரொவ்வொ பா4த் தாய்,anggu rovvo bhaat taay,இன்னும் கொஞ்சம் சோறு போடு,Put some more rice
ஸில்லபா4த்,sillabhaat,"பழையசோறு, பழைய சாதம்","A meal of leftover rice soaked in water at night, Stale meal",அத்தொ அஸ்கி கோன் ஸில்லபா4த் கா2ராஸ்?,atto aski kOn sillabhaat khaaraas?,இப்போதெல்லாம் யார் பழையசோறு சாப்பிடுகிறார்கள்?,Who eats stale meal these days?
கென்னி பேஸ்,kenni pEs,"நொய்க்கஞ்சி, அரிசிக் கஞ்சி",Rice Porridge,ஆங்கு3 ஹுன்னொ ஸுட்டலெங்கு3 கென்னி பேஸ் ஒண்டேஸ்,aanggu hunno suTTalenggu kenni pEs oNTEs,காய்ச்சல் விடும்வரை நொய்க்கஞ்சி மட்டும் தான்,Only rice porridge until the fever subsides
ஸுகு3ட்,suguT,களி,Pudding,பெ3ய்லனுக் கேடு பொ3லமுக் உடி3து3 ஸுகு3ட் தே3னு,beylanuk kETu bolamuk uDidu suguT dEnu,பெண்களுக்கு இடுப்பு பலத்திற்கு உளுந்து களி கொடுப்பார்கள்,"For women, they give dal pudding to strengthen their hips"
அம்பி3ல்,ambil,கூழ்,"Gruel, Pulp, Mush",ஆடி3 ம்ஹடா3ம் மாரியம்மா தௌ4ராம் அம்பி3ல் தே3ஸுன்,aaDi mhaDaam maariyammaa dhauraam ambil dEsun,ஆடி மாதம் மாரியம்மன் கோவிலில் கூழ் ஊற்றுவார்கள்,"In the month of Aadi, they serve gruel in the Mariamman temple"
அம்ருத்,amrut,"அமிழ்தம், அமுதம்","Nectar, Elixir",ஸோகும் பனி மெல்லொ அம்ருத் ஸொகன் லக3யி,sOkum pani mello amrut sokan lagayi,தாகத்தில் தண்ணீர் கூட அமுதம் போல் தெரியும்,Even water seems like elixir in thirst
ரும்பி,rumpi,"அமிழ்தம், அமுதம்","Nectar, Elixir",பு4க்லாக் ஸுக்கெ ரொட்டி மெல்லொ ரும்பி,bhuklaak sukke roTTi mello rumpi,பசித்தவனுக்கு காய்ந்த ரொட்டியும் அமுதம்,Even dry bread is elixir for the hungry
ஸம்பா3ர்,sambaar,சாம்பார்,"Spicy gravy, stew, broth",ஸெவாக்கய்லா ஸம்பா4ர் ருசிகன் ஸே,sevaakkaylaa sambhaar rucikan sE,முருங்கைக்காய் சாம்பார் ருசியாக உள்ளது,Drumstick sambar is delicious
அவ்ண்டி,avNTi,"குழம்பு, புளிக்குழம்பு","Tamarind gravy, stew, broth",அவ்ண்டி தீ3தி3 ஹொயெத் மெள்ளி நஜ்ஜானி,avNTi deedi hoyet meLLi najjaani,புளிக்குழம்பு இரண்டு நாளானாலும் கெடுவதில்லை,The tamarind gravy does not spoil even for two days
அம்டி,amTi,"குழம்பு, புளிக்குழம்பு","Tamarind gravy, stew, broth",அம்டி ககொ3 கொடு3 லக3ரியோ?,amTi kago koDu lagariyO?,புளிக்குழம்பு ஏன் கசப்பாக இருக்கிறது?,Why does tamarind gravy taste bitter?
கொ3ஜ்ஜு,gojju,"குழம்பு, புளிக்குழம்பு","Tamarind gravy, stew, broth",கொ3ஜ்ஜு ஸெர்க்க தப்பிரனி. தாடொ3 ஸே !,gojju serkka tappirani. taaDo sE !,புளிக்குழம்பு சரியாக கொதிக்கவில்லை. தண்ணீராக இருக்கிறது !,The tamarind gravy is not boiled properly. It is watery!
கொள்கர்,koLkar,காரக்குழம்பு,"Chilli Gravy, stew, broth",கொள்கர்யா? வஸுனொ துக்கரஸ் !,koLkaryaa? vasuno tukkaras !,காரக்குழம்பா? வாசனை நன்றாக வருகிறது !,Chilli gravy? Smells good!
மிரி கொள்கர்,miri koLkar,மிளகு குழம்பு,"Pepper Gravy, stew, broth",மிரி கொள்கர் வேன் ஸொட்3லியெத் போட் து3க்காய்,miri koLkar vEn soDliyet pOT dukkaay,மிளகு குழம்பு அதிகம் ஊற்றினால் வயிறு வலிக்கும்,Pouring too much pepper broth will cause stomach ache
லொஸனு கொள்கர்,losanu koLkar,பூண்டு குழம்பு,"Garlic Gravy, stew, broth",லொஸனு கொள்கர் போட்பு2கி3க் சொக்கடு3,losanu koLkar pOTphugik cokkaDu,பூண்டு குழம்பு வாய்வுக்கு நல்லது,Garlic gravy is good for flatulence
சைனா அவ்ண்டி,cainaa avNTi,கறிக்குழம்பு,"Mutton gravy, stew, broth",ஜு2கு3 தெனு ஐதார்தி3 சைனா அவ்ண்டி கெரஸுனு,jhugu tenu aitaardi cainaa avNTi kerasunu,நிறைய பேர் ஞாயிறன்று கறிக்குழம்பு செய்கிறார்கள்,Many people make mutton gravy on Sunday
ப4ஜ்ஜி சார்,bhajji caar,கீரை குழம்பு,"Spinach gravy, Green Stew, broth",ப4ஜ்ஜி சாரு ருசி கொம்மன்கன் ர்ஹாயி,bhajji caaru ruci kommankan rhaayi,கீரைக் குழம்பு இளஞ்சுவையில் இருக்கும்,Spinach gravy tastes unfermented
தெ4ய்ஞ் அவ்ண்டி,dheynj avNTi,மோர்க்குழம்பு,"Whey gravy, stew, broth",தெ4ய்ஞ் அவ்ண்டிம் பி3ஜ்ஜெ வடொ3 ருசிகன் ர்ஹாயி,dheynj avNTim bijje vaDo rucikan rhaayi,மோர்க்குழம்பில் ஊறிய வடை சுவையாக இருக்கும்,Donut soaked in whey gravy is delicious
தெ4ஞி அம்டி,dhenji amTi,மோர்க்குழம்பு,"Whey gravy, stew, broth",தெ4ஞி அம்டி ரொவ்வொ கெ4டி3ம் கெர்த்துவாய்,dhenji amTi rovvo gheDim kerttuvaay,மோர்க்குழம்பை சிறிது நேரத்தில் செய்துவிடலாம்,Whey gravy can be made in little time
திம்டி,timTi,ரசம்,Indian Soup,ஒதெனுன் திம்டிக் போ3னிம் சொட்3லி பேஸுன்,otenun timTik bOnim coDli pEsun,சிலர் ரசத்தை குவளையில் ஊற்றி குடிக்கிறார்கள்,Some people pour Indian soup into a tumbler and drink it
பிள்சார்,piLcaar,ரசம்,Indian Soup,ஜெமனு பிள்சார் பெ4ளி ருசிகன் ர்ஹாயி,jemanu piLcaar bheLi rucikan rhaayi,திருமண விருந்தில் ரசம் மிகச் சுவையாக இருக்கும்,Indian soup is very delicious in wedding feast
சீஸ் அம்டி,cees amTi,ரசம்,Indian soup,சீஸ் அம்டி ஜீர்ணுக் ஸஹாவ் கெரயி,cees amTi jeerNuk sahaav kerayi,ரசம் செரிமானத்திற்கு உதவும்,Indian soup helps in digestion
கெட்டு பிள்சார்,keTTu piLcaar,பருப்பு ரசம்,Lentle Indian Soup,ஒதெனுன் கெட்டு பிள்சார் ஒண்டேஸ் ஸொட்3லன்,otenun keTTu piLcaar oNTEs soDlan,சிலர் பருப்பு ரசம் மட்டுமே ஊற்றிக்கொள்வார்கள்,Some people take only lentle Indian Soup
தெ4ய்ஞ்,dheynj,தயிர்,"Curd, Yogurt",ஜு2கு3தெங்கொ3 தெ4ய்ஞ் அம்ப3ட்கன் ர்ஹியெதி3ஸ் ஒப்பாய்,jhugutenggo dheynj ambaTkan rhiyedis oppaay,பலருக்கு தயிர் புளித்திருந்தால் தான் பிடிக்கும்,Many people like yogurt only if it is fermented
தெ4ஞி,dhenji,தயிர்,"Curd, Yogurt",தெ4ஞி அம்ப3ட்கன் ர்ஹியெத் மீட் செர்ச்சுல்னொ,dhenji ambaTkan rhiyet meeT cercculno,தயிர் புளிப்பாக இருந்தால் உப்பு சேர்க்கவேண்டும்,Add salt if curd is sour
தெ4ய்ஞ் பனி,dheynj pani,மோர்,Butter milk,தின்னாள் வேள் தெ4ய்ஞ் பனி மௌடொ3 தக3ஸுன்,tinnaaL vEL dheynj pani mauDo tagasun,திருவிழாவின் போது மோர் பந்தல் போடுவார்கள்,During the festival they put up buttermilk bunting
தெ4ஞி பனி,dhenji pani,மோர்,Butter milk,ஹூனுகலமு தெ4ஞி பனி பேத்தெ சொக்கடு3,hoonukalamu dhenji pani pEtte cokkaDu,வெயில்காலத்தில் மோர் குடிப்பது நல்லது,It is good to drink buttermilk in summer
தாகு,taaku,மோர்,Butter milk,தாகு வேன் பியெத் ஹக்3கு3னொ ஹொய்யாய்,taaku vEn piyet hagguno hoyyaay,மோர் அதிகம் குடித்தால் வயிற்றுப்போக்கு ஏற்படும்,Drinking too much buttermilk can cause diarrhoea
கெ2ரஸ்,kheras,பாலாடை (பனீர்),Cottage cheese,தூ3த் சொக்கட் அடாத்திஸொ தப்படி3 கெ2ரஸ் கெரஸுன்,doot cokkaT aTaattiso tappaDi kheras kerasun,பால் நன்றாக சுண்டும்படி கொதிக்க வைத்து பாலாடை செய்கிறார்கள்,Cottage cheese is made by boiling milk thoroughly until it coagulates
லொனி,loni,வெண்ணை,Butter,தெ4ய்ஞிக் கு3ஸிலி லொனி ஹெட3ஸுனு,dheynjik gusili loni heDasunu,தயிரைக் கடைந்து வெண்ணெய் எடுப்பார்கள்,Butter is extracted by churning the curd
தூப்,toop,"எண்ணை, நெய்","Clarified butter, Ghee",சோட் தூப் இக்கெதி3 ஹொயெத் மெல்லொ நஜ்ஜானா,cOT toop ikkedi hoyet mello najjaanaa,நெய் எவ்வளவு நாள் ஆனாலும் கெடாது,Ghee does not go bad no matter how long it lasts
கய்லொகெஸுர் க2வ்னம்,kaylokesur khavnam,காய்கறி உணவு,Salad,"துங்கொ3 கய்லொகெஸுர் க2வ்னம்தி3, ரெஸ்ஸுதி3 காய்தி3 பஜெயா?","tunggo kaylokesur khavnamdi, ressudi kaaydi pajeyaa?",உங்களுக்கு காய்கறி உணவு அல்லது சாறு ஏதாவது வேண்டுமா?,Would you like some salad or soup ?
குட்கிரி,kuTkiri,சுரைக்காய் கூட்டு,Bottle gourd Curry,ஹிந்தொ3 அவ்ரெ கொ4ம்மொ பொட்கு3லா குட்கிரி,hindo avre ghommo poTgulaa kuTkiri,இன்று எங்கள் வீட்டில் புடலங்காய் கூட்டு,"Today, we have bottle gourd curry at home"
பொள்டினி,poLTini,பொரியல்,Fries,துங்கொ3 க3வுரு பொள்டினி ஒப்பாய்யா?,tunggo gavuru poLTini oppaayyaa?,உங்களுக்கு காரட் பொரியல் பிடிக்குமா?,Do you like carrot fries?
தெள்னி,teLni,எண்ணை பொரியல்,Deep frying,தெள்னியொ க2யெத் பா4ர் தக3யி,teLniyo khayet bhaar tagayi,எண்ணெயில் பொரித்ததை சாப்பிட்டால் எடை போடும்,"Eating something deep fried in oil, will gain weight"
பு4ஞ்ஜினி,bhunjjini,வறுத்தல்,Roasting,பொ2ன்னிஞ்சென்னாக் ஹுலாம் பு4ஞ்ஜனு,phonninjcennaak hulaam bhunjjanu,சோளத்தை நெருப்பில் வறுப்பார்கள்,Corn is roasted on fire
அம்ப3ட்,ambaT,கறி மசாலா,Curry masala,கென்னுனுக் அம்ப3ட் கெரி பா4த் ஸெரொ கா2ஸுனு,kennunuk ambaT keri bhaat sero khaasunu,தானியங்களை கறியாக சமைத்து உணவுடன் சாப்பிடுகிறார்கள்,Grains are cooked as curry masala and eaten with food
கச்சென்னா அம்ப3ட்,kaccennaa ambaT,கொண்டைக்கடலை கறி,Chickpea curry,கச்சென்னா அம்ப3ட் ரொவ்வொ கெ4டி3ம் ஸெஜ்ஜாய்,kaccennaa ambaT rovvo gheDim sejjaay,கொண்டைக்கடலை கறி சிறிது நேரத்தில் தீர்ந்துவிடும்,The chickpea curry runs out in no time
கென்னு அம்ப3ட்,kennu ambaT,மொச்சைப் பயறு கறி,Lima bean curry,வாரும் ஒண்டெதி3 கென்னு அம்ப3ட் கெர்னொ,vaarum oNTedi kennu ambaT kerno,வாரத்தில் ஒரு நாள் மொச்சைப் பயறு கறி செய்யவேண்டும்,One day in a week should make Lima beans curry
ராஜ்மா அம்ப3ட்,raajmaa ambaT,சிவப்பு காராமணி கறி,Kidney bean curry,ஜெமனும் ராஜ்மா அம்ப3ட் ஹொவ்ட்3யாஸி,jemanum raajmaa ambaT hovDyaasi,விருந்தில் சிவப்பு காராமணி கறி பரிமாறினார்கள்,Kidney bean curry was served at the feast
"பு3ள்ளா அம்ப3ட், கெளங்கு3 அம்ப3ட்","buLLaa ambaT, keLanggu ambaT",உருளைக்கிழங்கு கறி,Potato curry,"பு3ள்ளா அம்ப3ட் பை4ரி, சப்பாத்தி ஸெரொ மெல்லொ க2வாயி","buLLaa ambaT bhairi, cappaatti sero mello khavaayi","உருளைக்கிழங்கு கறியை பூரி, சப்பாத்தியுடனும் சாப்பிடலாம்",Potato curry can be eaten with poori and chapati
சொவ்ளா பொள்டினி,covLaa poLTini,"தட்டாம் பயறு பொரியல், காராமணி பொரியல்",Red cowpea fries,அம்ப3ட் பா4துக் சொவ்ளா பொள்டினி தொ2வனு,ambaT bhaatuk covLaa poLTini thovanu,புளியோதரையுடன் தட்டாம் பயறு பொரியல் வைப்பார்கள்,Red cowpea fries is served with tamarind rice
தா3ல்,daal,பருப்பு துவையல்,Lentil curry,உத்தர் பா4ரதும் சப்பாத்தி ஸெரொ தா3ல் ஒத்திலி கா2ஸுன்,uttar bhaaratum cappaatti sero daal ottili khaasun,வட இந்தியாவில் சப்பாத்தியை பருப்பு கூட்டு தொட்டு சாப்பிடுவார்கள்,"In North India, chapatis are eaten with lentil curry"
தா3ல் பனி,daal pani,பருப்பு நீர்,Lentil stew,தா3ல் பனிகின் தூப் ஸொட்3லி பா4த் கா2ஸுனு,daal panikin toop soDli bhaat khaasunu,பருப்பு மற்றும் நெய்யுடன் சாதம் சாப்பிடுவார்கள்,People eat rice with lentil stew and ghee
சென்னா தா3ல்,cennaa daal,பொட்டுக்கடலை துவையல்,Roasted gram split curry,கொள்கர் ஸெரொ சென்னா தா3ல் செரி ஜாஸு,koLkar sero cennaa daal ceri jaasu,காரக்குழம்புடன் பொட்டுக்கடலை துவையல் நன்றாக இருக்கும்,Roasted gram curry with Chilli gravy goes well
லுப்3பி3ன்,lubbin,நெல்லிக்காய் மசியல்,Gooseberry paste,அம்பு3லாக் சொக்கட் லுப்3பி3கின் லுப்3பி3ன் கெரஸுன்,ambulaak cokkaT lubbikin lubbin kerasun,நெல்லிக்காயை நன்றாக மசித்து நெல்லிக்காய் மசியல் செய்கிறார்கள்,Gooseberry paste made by mashing Gooseberry well
லிப்3பி3ன்,libbin,நெல்லிக்காய் மசியல்,Gooseberry paste,பிள்சாரு பா4த் ஸெரொ லிப்3பி3ன் ருசிகொ ர்ஹாஸு,piLcaaru bhaat sero libbin ruciko rhaasu,ரசம் சாதத்துடன் நெல்லிக்காய் மசியல் சுவையாக இருக்கும்,Gooseberry paste is delicious with rasam rice
